Item Title,Publication Title,Book Series Title,Journal Volume,Journal Issue,Item DOI,Authors,Publication Year,URL,Content Type
"Tagungsband des 3. Kongresses Montage Handhabung Industrieroboter","","","","","10.1007/978-3-662-56714-2","Prof. Dr. Thorsten SchüppstuhlProf. Dr. Kirsten TrachtProf. Dr. Jörg Franke","2018","http://link.springer.com/book/10.1007/978-3-662-56714-2","Book"
"Interviews and Case Studies","Achieving DevOps","","","","10.1007/978-1-4842-4388-6_9","Dave HarrisonKnox Lively","2019","http://link.springer.com/chapter/10.1007/978-1-4842-4388-6_9","Chapter"
"GIS Software Product Development Challenges in the Era of Cloud Computing","New Thinking in GIScience","","","","10.1007/978-981-19-3816-0_15","Fuxiang Frank Xia","2022","http://link.springer.com/chapter/10.1007/978-981-19-3816-0_15","Chapter"
"Online Exam Monitoring Application as Microservices","International Conference on Innovative Computing and Communications","","","","10.1007/978-981-19-2535-1_49","Sree Pranavi GanugapatiRakshashri NatarajanAbhijnana KashyapS. SuganthiPrasad B. Honnavalli","2023","http://link.springer.com/chapter/10.1007/978-981-19-2535-1_49","Chapter"
"Using Open Source Intelligence as a Tool for Reliable Web Searching","SN Computer Science","","2","5","10.1007/s42979-021-00777-4","Bipin Kumar RaiRavi VermaShiva Tiwari","2021","http://link.springer.com/article/10.1007/s42979-021-00777-4","Article"
"Intent-Based Placement of Microservices in Computing Continuums","Future Intent-Based Networking","","","","10.1007/978-3-030-92435-5_3","Josef SpillnerJuliana Freitag BorinLuiz Fernando Bittencourt","2022","http://link.springer.com/chapter/10.1007/978-3-030-92435-5_3","Chapter"
"Design and Architecture: Patterns and Practices","Practical Microsoft Visual Studio 2015","","","","10.1007/978-1-4842-2313-0_4","Peter Ritchie","2016","http://link.springer.com/chapter/10.1007/978-1-4842-2313-0_4","Chapter"
"18. Internationales Stuttgarter Symposium","Proceedings","","","","10.1007/978-3-658-21194-3","Prof. Dr. Michael BargendeProf. Dr. Hans-Christian ReussProf. Dr. Jochen Wiedemann","2018","http://link.springer.com/book/10.1007/978-3-658-21194-3","Book"
"Designing the New Digital Innovation Environment","CIOs and the Digital Transformation","","","","10.1007/978-3-319-31026-8_9","Massimo Messina","2018","http://link.springer.com/chapter/10.1007/978-3-319-31026-8_9","Chapter"
"Issues and Challenges in Autonomic Computing and Resource Management","Autonomic Computing in Cloud Resource Management in Industry 4.0","","","","10.1007/978-3-030-71756-8_5","G. Sobers Smiles DavidT. HemanthPethuru RajP. S. Eliahim Jeevaraj","2021","http://link.springer.com/chapter/10.1007/978-3-030-71756-8_5","Chapter"
"Efficient GitHub Crawling Using the GraphQL API","Computational Science and Its Applications – ICCSA 2022 Workshops","","","","10.1007/978-3-031-10548-7_48","Adrian JobstDaniel AtzbergerTim CechWilly ScheibelMatthias TrappJürgen Döllner","2022","http://link.springer.com/chapter/10.1007/978-3-031-10548-7_48","Chapter"
"The Benefits of Using Experimental Exploration for Cloud Migration Analysis and Planning","Cloud Computing and Service Science","","","","10.1007/978-3-319-94959-8_9","Frank FowleyDivyaa Manimaran ElangoHany MagarClaus Pahl","2018","http://link.springer.com/chapter/10.1007/978-3-319-94959-8_9","Chapter"
"Software Migration and Architecture Evolution with Industrial Platforms: A Multi-case Study","Software Architecture","","","","10.1007/978-3-030-00761-4_22","Konstantinos PlakidasDaniel SchallUwe Zdun","2018","http://link.springer.com/chapter/10.1007/978-3-030-00761-4_22","Chapter"
"Extending  Kubernetes","","","","","10.1007/978-1-4842-7095-0","Onur Yilmaz","2021","http://link.springer.com/book/10.1007/978-1-4842-7095-0","Book"
"Implementing Microservices","Building Microservices Applications on Microsoft Azure","","","","10.1007/978-1-4842-4828-7_2","Harsh ChawlaHemant Kathuria","2019","http://link.springer.com/chapter/10.1007/978-1-4842-4828-7_2","Chapter"
"Cloud Native Data Architecture","Cloud Native Architecture and Design","","","","10.1007/978-1-4842-7226-8_8","Shivakumar R Goniwada","2022","http://link.springer.com/chapter/10.1007/978-1-4842-7226-8_8","Chapter"
"Metric-centered and technology-independent architectural views for software comprehension","Journal of Software Engineering Research and Development","","6","1","10.1186/s40411-018-0060-6","Luis F. MendivelsoKelly GarcésRubby Casallas","2018","http://link.springer.com/article/10.1186/s40411-018-0060-6","Article"
"Introduction to Modern Monitoring","Monitoring Cloud-Native Applications","","","","10.1007/978-1-4842-6888-9_1","Mainak ChakrabortyAjit Pratap Kundan","2021","http://link.springer.com/chapter/10.1007/978-1-4842-6888-9_1","Chapter"
"Kuksa: A Cloud-Native Architecture for Enabling Continuous Delivery in the Automotive Domain","Product-Focused Software Process Improvement","","","","10.1007/978-3-030-35333-9_32","Ahmad BanijamaliPooyan JamshidiPasi KuvajaMarkku Oivo","2019","http://link.springer.com/chapter/10.1007/978-3-030-35333-9_32","Chapter"
"The emergence of native multi-sided platforms and their influence on incumbents","Electronic Markets","","29","4","10.1007/s12525-019-00350-1","Andreas HeinMaximilian SchreieckManuel WiescheMarkus BöhmHelmut Krcmar","2019","http://link.springer.com/article/10.1007/s12525-019-00350-1","Article"
"A Distributed Modular Scalable and Generic Framework for Parallelizing Population-Based Metaheuristics","Parallel Processing and Applied Mathematics","","","","10.1007/978-3-030-43229-4_37","Hatem KhalloofPhil OstheimerWilfried JakobShadi ShahoudClemens DuepmeierVeit Hagenmeyer","2020","http://link.springer.com/chapter/10.1007/978-3-030-43229-4_37","Chapter"
"Management digitaler Plattformen","Informationsmanagement und digitale Transformation","","","","10.1007/978-3-658-21214-8","Dr. Manuel WieschePetra SauerProf. Dr. Jürgen KrimmlingProf. Dr. Helmut Krcmar","2018","http://link.springer.com/book/10.1007/978-3-658-21214-8","Book"
"A Formal Framework for Specifying and Verifying Microservices Based Process Flows","Software Engineering and Formal Methods","","","","10.1007/978-3-319-74781-1_14","Matteo CamilliCarlo BellettiniLorenzo CapraMattia Monga","2018","http://link.springer.com/chapter/10.1007/978-3-319-74781-1_14","Chapter"
"Software Due Diligence","","","","","10.1007/978-3-662-53062-7","Dipl.-Ing. Christian Demant","2018","http://link.springer.com/book/10.1007/978-3-662-53062-7","Book"
"Scaling Development","Designing Microservices with Django","","","","10.1007/978-1-4842-5358-8_6","Akos Hochrein","2019","http://link.springer.com/chapter/10.1007/978-1-4842-5358-8_6","Chapter"
"Microservices","Spring Boot Messaging","","","","10.1007/978-1-4842-1224-0_11","Felipe Gutierrez","2017","http://link.springer.com/chapter/10.1007/978-1-4842-1224-0_11","Chapter"
"Applying DDD to the Code","Pro Java Microservices with Quarkus and Kubernetes","","","","10.1007/978-1-4842-7170-4_9","Nebrass Lamouchi","2021","http://link.springer.com/chapter/10.1007/978-1-4842-7170-4_9","Chapter"
"A Systematic Review on Software Architectures for IoT Systems and Future Direction to the Adoption of Microservices Architecture","SN Computer Science","","1","6","10.1007/s42979-020-00359-w","Abdul Razzaq","2020","http://link.springer.com/article/10.1007/s42979-020-00359-w","Article"
"Cargo Tracker: Eclipse MicroProfile","Practical Domain-Driven Design in Enterprise Java","","","","10.1007/978-1-4842-4543-9_4","Vijay Nair","2019","http://link.springer.com/chapter/10.1007/978-1-4842-4543-9_4","Chapter"
"Swarm Based System for Management of Containerized Microservices in a Cloud Consisting of Heterogeneous Servers","Information Systems Architecture and Technology: Proceedings of 38th International Conference on Information Systems Architecture and Technology – ISAT 2017","","","","10.1007/978-3-319-67220-5_24","Waldemar KarwowskiMarian RusekGrzegorz DwornickiArkadiusz Orłowski","2018","http://link.springer.com/chapter/10.1007/978-3-319-67220-5_24","Chapter"
"DevOps and Its Philosophy: Education Matters!","Microservices","","","","10.1007/978-3-030-31646-4_14","Evgeny BobrovAntonio BucchiaroneAlfredo CapozuccaNicolas GuelfiManuel MazzaraAlexandr NaumchevLarisa Safina","2020","http://link.springer.com/chapter/10.1007/978-3-030-31646-4_14","Chapter"
"API-First Design: A Survey of the State of Academia and Industry","ITNG 2022 19th International Conference on Information Technology-New Generations","","","","10.1007/978-3-030-97652-1_10","Nicole BeaulieuSergiu M. DascaluEmily Hand","2022","http://link.springer.com/chapter/10.1007/978-3-030-97652-1_10","Chapter"
"Containerization technologies: taxonomies, applications and challenges","The Journal of Supercomputing","","78","1","10.1007/s11227-021-03914-1","Ouafa BentalebAdam S. Z. BelloumAbderrazak SebaaAouaouche El-Maouhab","2022","http://link.springer.com/article/10.1007/s11227-021-03914-1","Article"
"Smart Cities/Smart Regions – Technische, wirtschaftliche und gesellschaftliche Innovationen","","","","","10.1007/978-3-658-25210-6","Prof. Dr. Jorge Marx GómezAndreas SolsbachDr. Thomas KlenkeProf. Dr. Volker Wohlgemuth","2019","http://link.springer.com/book/10.1007/978-3-658-25210-6","Book"
"A Domain-Specific Language for Payroll Calculations: An Experience Report from DATEV","Domain-Specific Languages in Practice","","","","10.1007/978-3-030-73758-0_4","Markus VoelterSergej KoščejevMarcel RiedelAnna DeitschAndreas Hinkelmann","2021","http://link.springer.com/chapter/10.1007/978-3-030-73758-0_4","Chapter"
"Clinically-validated technologies for assisted living","Journal of Ambient Intelligence and Humanized Computing","","","","10.1007/s12652-021-03419-y","Susanna SpinsanteAngelica PoliJordi Mongay BatallaPiotr KrawiecCiprian DobreLidia BǎjenaruConstandinos X. MavromoustakisCostas S. CostantinouGregor MolanAnna Marie HerghelegiuGabriel Ioan PradaRozeta DrǎghiciHoracio González–Vélez","2021","http://link.springer.com/article/10.1007/s12652-021-03419-y","Article"
"Event-Based Customization of Multi-tenant SaaS Using Microservices","Coordination Models and Languages","","","","10.1007/978-3-030-50029-0_11","Espen Tønnessen NordliPhu H. NguyenFranck ChauvelHui Song","2020","http://link.springer.com/chapter/10.1007/978-3-030-50029-0_11","Chapter"
"An Interoperable Cloud Platform for the Garment Industry","Intelligent Systems and Applications","","","","10.1007/978-3-031-16075-2_32","Francisco MoraisNuno SoaresRui RibeiroMarcelo AlvesPedro RochaAna LimaRicardo J. Machado","2023","http://link.springer.com/chapter/10.1007/978-3-031-16075-2_32","Chapter"
"Joining Jolie to Docker","Proceedings of 5th International Conference in Software Engineering for Defence Applications","","","","10.1007/978-3-319-70578-1_16","Alberto GiarettaNicola DragoniManuel Mazzara","2018","http://link.springer.com/chapter/10.1007/978-3-319-70578-1_16","Chapter"
"Designing the Integration Layer","Building Digital Experience Platforms","","","","10.1007/978-1-4842-4303-9_5","Shailesh Kumar ShivakumarSourabhh Sethii","2019","http://link.springer.com/chapter/10.1007/978-1-4842-4303-9_5","Chapter"
"Internet of Things and Microservices in Supply Chain: Cybersecurity Challenges, and Research Opportunities","Advanced Information Networking and Applications","","","","10.1007/978-3-030-99619-2_52","Belal AlsinglawiLihong ZhengMuhammad Ashad KabirMd Zahidul IslamDave SwainWill Swain","2022","http://link.springer.com/chapter/10.1007/978-3-030-99619-2_52","Chapter"
"Cybersecurity Best Practices","","","","","10.1007/978-3-658-21655-9","Michael BartschDr. Stefanie Frey","2018","http://link.springer.com/book/10.1007/978-3-658-21655-9","Book"
"An Experience Report on Modernizing I/O Configuration Software","Software Architecture","","","","10.1007/978-3-030-86044-8_18","Kiana BuschNorman Christopher BöwingSimon SpinnerQais NoorshamsMichael Grötzner","2021","http://link.springer.com/chapter/10.1007/978-3-030-86044-8_18","Chapter"
"Design Patterns and Microservices for Reengineering of Legacy Web Applications","Smart Computing Techniques and Applications","","","","10.1007/978-981-16-1502-3_38","V. DattatreyaK. V. Chalapati RaoM. Raghava","2021","http://link.springer.com/chapter/10.1007/978-981-16-1502-3_38","Chapter"
"Docker Cluster Management for the Cloud - Survey Results and Own Solution","Journal of Grid Computing","","14","2","10.1007/s10723-016-9366-y","René PeinlFlorian HolzschuherFlorian Pfitzer","2016","http://link.springer.com/article/10.1007/s10723-016-9366-y","Article"
"Migrating from a Centralized Data Warehouse to a Decentralized Data Platform Architecture","Product-Focused Software Process Improvement","","","","10.1007/978-3-030-91452-3_3","Antti LoukialaJuha-Pekka JoutsenlahtiMikko RaatikainenTommi MikkonenTimo Lehtonen","2021","http://link.springer.com/chapter/10.1007/978-3-030-91452-3_3","Chapter"
"Measuring the Business Value of Infrastructure Migration to the Cloud","Measuring the Business Value of Cloud Computing","","","","10.1007/978-3-030-43198-3_2","Pierangelo RosatiTheo Lynn","2020","http://link.springer.com/chapter/10.1007/978-3-030-43198-3_2","Chapter"
"The SDK4ED Platform for Embedded Software Quality Improvement - Preliminary Overview","Computational Science and Its Applications – ICCSA 2020","","","","10.1007/978-3-030-58811-3_73","Miltiadis SiavvasDimitrios TsoukalasCharalampos MarantosAngeliki-Agathi TsintziraMarija JankovicDimitrios SoudrisAlexander ChatzigeorgiouDionysios Kehagias","2020","http://link.springer.com/chapter/10.1007/978-3-030-58811-3_73","Chapter"
"A Polystore Based Database Operating System (DBOS)","Heterogeneous Data Management, Polystores, and Analytics for Healthcare","","","","10.1007/978-3-030-71055-2_1","Michael CafarellaDavid DeWittVijay GadepallyJeremy KepnerChristos KozyrakisTim KraskaMichael StonebrakerMatei Zaharia","2021","http://link.springer.com/chapter/10.1007/978-3-030-71055-2_1","Chapter"
"Adaptive Resource Provisioning and Auto-scaling for Cloud Native Software","Information and Software Technologies","","","","10.1007/978-3-319-99972-2_9","Olesia PozdniakovaDalius MažeikaAurimas Cholomskis","2018","http://link.springer.com/chapter/10.1007/978-3-319-99972-2_9","Chapter"
"ICT Requirements in a Smart Grid Environment","TSO-DSO Interactions and Ancillary Services in Electricity Transmission and Distribution Networks","","","","10.1007/978-3-030-29203-4_4","Seppo HorsmanheimoLotta TuomimäkiRaúl Rodríguez SanchezFilip Pröstl AndrénClaus Amtrup Andersen","2020","http://link.springer.com/chapter/10.1007/978-3-030-29203-4_4","Chapter"
"Modularizing Laravel","Domain-Driven Laravel","","","","10.1007/978-1-4842-6023-4_8","Jesse Griffin","2021","http://link.springer.com/chapter/10.1007/978-1-4842-6023-4_8","Chapter"
"A Container-Driven Approach for Resource Provisioning in Edge-Fog Cloud","Algorithmic Aspects of Cloud Computing","","","","10.1007/978-3-030-58628-7_5","Hamid Mohammadi FardRadu ProdanFelix Wolf","2020","http://link.springer.com/chapter/10.1007/978-3-030-58628-7_5","Chapter"
"21. Internationales Stuttgarter Symposium","Proceedings","","","","10.1007/978-3-658-33521-2","Prof. Dr. Michael BargendeProf. Dr. Hans-Christian ReussProf. Dr. Andreas Wagner","2021","http://link.springer.com/book/10.1007/978-3-658-33521-2","Book"
"Multi-cloud Management: Technologies, Tools, and Techniques","Software-Defined Cloud Centers","","","","10.1007/978-3-319-78637-7_10","Pethuru RajAnupama Raman","2018","http://link.springer.com/chapter/10.1007/978-3-319-78637-7_10","Chapter"
"Redundant and Reliable Architecture Based on Open Source Tools for Light-Rail-Transit On-Board-Systems","Reliability, Safety, and Security of Railway Systems. Modelling, Analysis, Verification, and Certification","","","","10.1007/978-3-319-68499-4_14","Vincenzo Di MassaMirko DamianiMaurizio PapiniGianluca Mandò","2017","http://link.springer.com/chapter/10.1007/978-3-319-68499-4_14","Chapter"
"Superlinear Speedup of Parallel Population-Based Metaheuristics: A Microservices and Container Virtualization Approach","Intelligent Data Engineering and Automated Learning – IDEAL 2019","","","","10.1007/978-3-030-33607-3_42","Hatem KhalloofPhil OstheimerWilfried JakobShadi ShahoudClemens DuepmeierVeit Hagenmeyer","2019","http://link.springer.com/chapter/10.1007/978-3-030-33607-3_42","Chapter"
"Smart Cities on the Cloud","Mediterranean Cities and Island Communities","","","","10.1007/978-3-319-99444-4_3","Christina KakderiPanagiotis TsarchopoulosNicos KomninosAnastasia Panori","2019","http://link.springer.com/chapter/10.1007/978-3-319-99444-4_3","Chapter"
"Der Weg in die Cloud","essentials","","","","10.1007/978-3-658-29101-3","Dominic LindnerPaul NieblerMarkus Wenzel","2020","http://link.springer.com/book/10.1007/978-3-658-29101-3","Book"
"Multimedia analysis platform for crime prevention and investigation","Multimedia Tools and Applications","","80","15","10.1007/s11042-020-10206-y","Francisco J. PérezVictor J. GarridoAlberto GarcíaMarcelo ZambranoRafał KozikMichał ChoraśDirk MühlenbergDirk PallmerWilmuth Müller","2021","http://link.springer.com/article/10.1007/s11042-020-10206-y","Article"
"BBServerless: A Bursty Traffic Benchmark for Serverless","Cloud Computing – CLOUD 2021","","","","10.1007/978-3-030-96326-2_4","Yanying LinKejiang YeYongkang LiPeng LinYingfei TangChengzhong Xu","2022","http://link.springer.com/chapter/10.1007/978-3-030-96326-2_4","Chapter"
"The Enterprise Technology Landscape","Business Innovation and ICT Strategies","","","","10.1007/978-981-13-1675-3_4","Sriram BirudavoluBiswajit Nag","2019","http://link.springer.com/chapter/10.1007/978-981-13-1675-3_4","Chapter"
"API Design","API Marketplace Engineering","","","","10.1007/978-1-4842-7313-5_7","Rennay Dorasamy","2022","http://link.springer.com/chapter/10.1007/978-1-4842-7313-5_7","Chapter"
"Analysing Microsoft Access Projects: Building a Model in a Partially Observable Domain","Reuse in Emerging Software Engineering Practices","","","","10.1007/978-3-030-64694-3_10","Santiago BragagnoloNicolas AnquetilStephane DucasseSeriai AbderrahmaneMustapha Derras","2020","http://link.springer.com/chapter/10.1007/978-3-030-64694-3_10","Chapter"
"Cloud Migration Fundamentals","Systematic Cloud Migration","","","","10.1007/978-1-4842-7252-7_2","Taras Gleb","2021","http://link.springer.com/chapter/10.1007/978-1-4842-7252-7_2","Chapter"
"A Systematic Mapping Study on Microservices","Recent Trends in Data Science and Soft Computing","","","","10.1007/978-3-319-99007-1_100","Mohammad Sadegh HamzehlouiShamsul SahibuddinKhalil Salah","2019","http://link.springer.com/chapter/10.1007/978-3-319-99007-1_100","Chapter"
"Definition: Highly-Distributed Systems","Highly-Distributed Systems","","","","10.1007/978-3-030-92829-2_1","Andriy LuntovskyyDietbert Gütter","2022","http://link.springer.com/chapter/10.1007/978-3-030-92829-2_1","Chapter"
"Teaching DevOps in Corporate Environments","Software Engineering Aspects of Continuous Development and New Paradigms of Software Production and Deployment","","","","10.1007/978-3-030-06019-0_8","Manuel MazzaraAlexandr NaumchevLarisa SafinaAlberto SillittiKonstantin Urysov","2019","http://link.springer.com/chapter/10.1007/978-3-030-06019-0_8","Chapter"
"Streaming readout for next generation electron scattering experiments","The European Physical Journal Plus","","137","8","10.1140/epjp/s13360-022-03146-z","Fabrizio AmeliMarco BattaglieriVladimir V. BerdnikovMariangela BondíSergey BoyarinovNathan BreiAndrea CelentanoLaura CappelliTommaso ChiarusiRaffaella De VitaCristiano FanelliVardan GyurjyanDavid LawrencePatrick MoranPaolo MusicoCarmelo Pellegrino","2022","http://link.springer.com/article/10.1140/epjp/s13360-022-03146-z","Article"
"Interactive Elicitation of Resilience Scenarios Based on Hazard Analysis Techniques","Software Architecture","","","","10.1007/978-3-031-15116-3_11","Sebastian FrankAlireza HakamianLion WagnerDominik KesimChristoph ZornJóakim von KistowskiAndré van Hoorn","2022","http://link.springer.com/chapter/10.1007/978-3-031-15116-3_11","Chapter"
"Towards reproducible computational drug discovery","Journal of Cheminformatics","","12","1","10.1186/s13321-020-0408-x","Nalini SchaduangratSamuel LampaSaw SimeonMatthew Paul GleesonOla SpjuthChanin Nantasenamat","2020","http://link.springer.com/article/10.1186/s13321-020-0408-x","Article"
"A Reference Architecture Model for Big Data Systems in the Finance Sector","Big Data and Artificial Intelligence in Digital Finance","","","","10.1007/978-3-030-94590-9_1","John SoldatosErnesto TroianoPavlos KranasAlessandro Mamelli","2022","http://link.springer.com/chapter/10.1007/978-3-030-94590-9_1","Chapter"
"Outlining Big Data Analytics in Health Sector with Special Reference to Covid-19","Wireless Personal Communications","","124","3","10.1007/s11277-021-09446-4","R. Biswas","2022","http://link.springer.com/article/10.1007/s11277-021-09446-4","Article"
"An Evaluation of Frameworks for Microservices Development","Advances in Service-Oriented and Cloud Computing","","","","10.1007/978-3-030-71906-7_8","Isabell SailerRobin LichtenthälerGuido Wirtz","2021","http://link.springer.com/chapter/10.1007/978-3-030-71906-7_8","Chapter"
"Automated Multi-cloud Operations and Container Orchestration","Software-Defined Cloud Centers","","","","10.1007/978-3-319-78637-7_9","Pethuru RajAnupama Raman","2018","http://link.springer.com/chapter/10.1007/978-3-319-78637-7_9","Chapter"
"Fog of Things: Fog Computing in Internet of Things Environments","Special Topics in Multimedia, IoT and  Web Technologies","","","","10.1007/978-3-030-35102-1_2","Leandro AndradeCleber LiraBrenno de MelloAndressa AndradeAntonio CoutinhoCássio Prazeres","2020","http://link.springer.com/chapter/10.1007/978-3-030-35102-1_2","Chapter"
"Service Cutter: A Systematic Approach to Service Decomposition","Service-Oriented and Cloud Computing","","","","10.1007/978-3-319-44482-6_12","Michael GyselLukas KölbenerWolfgang GierscheOlaf Zimmermann","2016","http://link.springer.com/chapter/10.1007/978-3-319-44482-6_12","Chapter"
"Airline Application Security in the Digital Economy: Tackling Security Challenges for Distributed Applications in Lufthansa Systems","Digitalization Cases","","","","10.1007/978-3-319-95273-4_3","Balázs SomoskőiStefan SpahrErkuden RiosOscar RipollesJacek DominiakTamás CservenyPéter BálintPeter MatthewsEider IturbeVictor Muntés-Mulero","2019","http://link.springer.com/chapter/10.1007/978-3-319-95273-4_3","Chapter"
"Webservices Engineering","Webservices","","","","10.1007/978-981-13-3224-1_7","Venkata Swamy MarthaMaurin Lenglart","2019","http://link.springer.com/chapter/10.1007/978-981-13-3224-1_7","Chapter"
"A survey on nature-inspired techniques for computation offloading and service placement in emerging edge technologies","World Wide Web","","","","10.1007/s11280-022-01053-y","Dinesh KumarGaurav BaranwalYamini ShankarDeo Prakash Vidyarthi","2022","http://link.springer.com/article/10.1007/s11280-022-01053-y","Article"
"Quality Evaluation of a Spring Cloud Microservices Architecture Implementation","Communication, Smart Technologies and Innovation for Society","","","","10.1007/978-981-16-4126-8_66","Antonio Quiña-MeraDavid Flores LandetaXavier Mauricio Rea-PeñafielCathy Guevara-Vega","2022","http://link.springer.com/chapter/10.1007/978-981-16-4126-8_66","Chapter"
"Autonomic Management Framework for Cloud-Native Applications","Journal of Grid Computing","","18","4","10.1007/s10723-020-09532-0","Joanna KosińskaKrzysztof Zieliński","2020","http://link.springer.com/article/10.1007/s10723-020-09532-0","Article"
"The Future of Apple Device Management","Apple Device Management","","","","10.1007/978-1-4842-5388-5_13","Charles EdgeRich Trouton","2020","http://link.springer.com/chapter/10.1007/978-1-4842-5388-5_13","Chapter"
"Scientific Services Consolidation Methods","Russian Microelectronics","","49","8","10.1134/S1063739720080144","A. A. ZatsarinnyV. A. KondrashevA. A. SorokinS. A. Denisov","2020","http://link.springer.com/article/10.1134/S1063739720080144","Article"
"Creating Web Applications","Beginning Scala 3","","","","10.1007/978-1-4842-7422-4_12","David PollakVishal LaykaAndres Sacco","2022","http://link.springer.com/chapter/10.1007/978-1-4842-7422-4_12","Chapter"
"Multi-cloud Brokerage Solutions and Services","Software-Defined Cloud Centers","","","","10.1007/978-3-319-78637-7_8","Pethuru RajAnupama Raman","2018","http://link.springer.com/chapter/10.1007/978-3-319-78637-7_8","Chapter"
"Generalized distributed four-domain digital twin system for intelligent manufacturing","Journal of Central South University","","29","1","10.1007/s11771-022-4926-8","Zhi-feng Liu 刘志峰Yue-ze Zhang 张月泽Cong-bin Yang 杨聪彬Zu-guang Huang 黄祖广Cai-xia Zhang 张彩霞Fu-gui Xie 谢福贵","2022","http://link.springer.com/article/10.1007/s11771-022-4926-8","Article"
"Leveraging cloud computing for the semantic web: review and trends","Soft Computing","","24","8","10.1007/s00500-019-04559-2","Oluwasegun AdedugbeElhadj BenkhelifaRussell CampionFeras Al-ObeidatAnoud Bani HaniUchitha Jayawickrama","2020","http://link.springer.com/article/10.1007/s00500-019-04559-2","Article"
"Deploy—Web Hosting Using Docker Container","Advances in Computing and Network Communications","","","","10.1007/978-981-33-6977-1_26","Minto SunnySen ShajiSheen SabuUdith UthamanGemini George","2021","http://link.springer.com/chapter/10.1007/978-981-33-6977-1_26","Chapter"
"MSA vs. MVC: Future Trends for Big Data Processing Platforms","Smart Computing and Communication","","","","10.1007/978-3-319-73830-7_31","Yuming LuWei LiuHaoxiang Cui","2018","http://link.springer.com/chapter/10.1007/978-3-319-73830-7_31","Chapter"
