Item Title,Publication Title,Book Series Title,Journal Volume,Journal Issue,Item DOI,Authors,Publication Year,URL,Content Type
"Information Technology as an Enabler of Digitisation","The Digital Transformation of the Automotive Industry","","","","10.1007/978-3-319-71610-7_8","Uwe Winkelhake","2018","http://link.springer.com/chapter/10.1007/978-3-319-71610-7_8","Chapter"
"The Green Computing Continuum: The OPERA Perspective","Hardware Accelerators in Data Centers","","","","10.1007/978-3-319-92792-3_4","A. SciontiO. TerzoP. RuiuG. GiordanengoS. CicciaG. UrliniJ. NiderM. RapoportC. PetrieR. ChamberlainG. RenaudD. TsafrirI. YanivD. Harryvan","2019","http://link.springer.com/chapter/10.1007/978-3-319-92792-3_4","Chapter"
"Learning Exercises and Solutions","Highly-Distributed Systems","","","","10.1007/978-3-030-92829-2_12","Andriy LuntovskyyDietbert Gütter","2022","http://link.springer.com/chapter/10.1007/978-3-030-92829-2_12","Chapter"
"Business Object Centric Microservices Patterns","On the Move to Meaningful Internet Systems: OTM 2019 Conferences","","","","10.1007/978-3-030-33246-4_30","Adambarage Anuruddha Chathuranga De AlwisAlistair BarrosColin FidgeArtem Polyvyanyy","2019","http://link.springer.com/chapter/10.1007/978-3-030-33246-4_30","Chapter"
"6G Mobile Wireless Networks","Computer Communications and Networks","","","","10.1007/978-3-030-72777-2","Dr. Yulei WuSukhdeep SinghTarik TalebAbhishek RoyHarpreet S. DhillonMadhan Raj KanagarathinamAloknath De","2021","http://link.springer.com/book/10.1007/978-3-030-72777-2","Book"
"Biologically Inspired Cognitive Architectures 2021","Studies in Computational Intelligence","","","","10.1007/978-3-030-96993-6","Prof. Valentin V. KlimovPh.D. David J. Kelley","2022","http://link.springer.com/book/10.1007/978-3-030-96993-6","Book"
"Organizational Impact on Software Development of eServices Techniques","Exploring Services Science","","","","10.1007/978-3-319-56925-3_6","Maurizio CavallariFrancesco TornieriMarco De Marco","2017","http://link.springer.com/chapter/10.1007/978-3-319-56925-3_6","Chapter"
"Human-Computer Interaction. User Experience and Behavior","Lecture Notes in Computer Science","","","","10.1007/978-3-031-05412-9","Masaaki Kurosu","2022","http://link.springer.com/book/10.1007/978-3-031-05412-9","Book"
"Docker Container Orchestration Management: A Review","Proceedings of the International Conference on Intelligent Vision and Computing (ICIVC 2021)","","","","10.1007/978-3-030-97196-0_12","Jigna N. AcharyaAnil C. Suthar","2022","http://link.springer.com/chapter/10.1007/978-3-030-97196-0_12","Chapter"
"Next Generation of Internet of Things","Lecture Notes in Networks and Systems","","","","10.1007/978-981-16-0666-3","Dr. Raghvendra KumarDr. Brojo Kishore MishraDr. Prasant Kumar Pattnaik","2021","http://link.springer.com/book/10.1007/978-981-16-0666-3","Book"
"Domain-Driven Architecture Modeling and Rapid Prototyping with Context Mapper","Model-Driven Engineering and Software Development","","","","10.1007/978-3-030-67445-8_11","Stefan KapfererOlaf Zimmermann","2021","http://link.springer.com/chapter/10.1007/978-3-030-67445-8_11","Chapter"
"Transit-hub: a smart public transportation decision support system with multi-timescale analytical services","Cluster Computing","","22","1","10.1007/s10586-018-1708-z","Fangzhou SunAbhishek DubeyJules WhiteAniruddha Gokhale","2019","http://link.springer.com/article/10.1007/s10586-018-1708-z","Article"
"Domain Objects and Microservices for Systems Development: A Roadmap","Proceedings of 5th International Conference in Software Engineering for Defence Applications","","","","10.1007/978-3-319-70578-1_10","Kizilov MikhailAntonio BucchiaroneManuel MazzaraLarisa SafinaVictor Rivera","2018","http://link.springer.com/chapter/10.1007/978-3-319-70578-1_10","Chapter"
"A microservices persistence technique for cloud-based online social data analysis","Cluster Computing","","24","3","10.1007/s10586-021-03244-0","Feras Al-ObeidatAnoud Bani-HaniOluwasegun AdedugbeMunir MajdalawiehElhadj Benkhelifa","2021","http://link.springer.com/article/10.1007/s10586-021-03244-0","Article"
"Real-Time Systems","","","","","10.1007/978-3-031-11992-7","Hermann KopetzWilfried Steiner","2022","http://link.springer.com/book/10.1007/978-3-031-11992-7","Book"
"Advances in Computer Science for Engineering and Education IV","Lecture Notes on Data Engineering and Communications Technologies","","","","10.1007/978-3-030-80472-5","Prof. Zhengbing HuProf. Sergey PetoukhovProf. Ivan DychkaProf. Matthew He","2021","http://link.springer.com/book/10.1007/978-3-030-80472-5","Book"
"Technological Innovation for Digitalization and Virtualization","IFIP Advances in Information and Communication Technology","","","","10.1007/978-3-031-07520-9","Prof. Luis M. Camarinha-Matos","2022","http://link.springer.com/book/10.1007/978-3-031-07520-9","Book"
"Computing Science, Communication and Security","Communications in Computer and Information Science","","","","10.1007/978-3-030-76776-1","Nirbhay ChaubeySatyen ParikhKiran Amin","2021","http://link.springer.com/book/10.1007/978-3-030-76776-1","Book"
"Become ITIL® 4 Foundation Certified in 7 Days","","","","","10.1007/978-1-4842-6361-7","Abhinav Krishna Kaiser","2021","http://link.springer.com/book/10.1007/978-1-4842-6361-7","Book"
"Mastering Azure API Management","","","","","10.1007/978-1-4842-8011-9","Sven Malvik","2022","http://link.springer.com/book/10.1007/978-1-4842-8011-9","Book"
"Current Trends in Communication and Information Technologies","Lecture Notes in Networks and Systems","","","","10.1007/978-3-030-76343-5","Petro VorobiyenkoProf. Mykhailo IlchenkoProf. Iryna Strelkovska","2021","http://link.springer.com/book/10.1007/978-3-030-76343-5","Book"
"Highlights in Practical Applications of Agents, Multi-Agent Systems, and Social Good. The PAAMS Collection","Communications in Computer and Information Science","","","","10.1007/978-3-030-85710-3","Fernando De La PrietaAlia El BolockDalila DurãesJoão CarneiroFernando LopesVicente Julian","2021","http://link.springer.com/book/10.1007/978-3-030-85710-3","Book"
"Enabling rank-based distribution of microservices among containers for green cloud computing environment","Peer-to-Peer Networking and Applications","","15","1","10.1007/s12083-021-01218-y","Abdul SaboorAhmad Kamil MahmoodAbdullah Hisam OmarMohd Fadzil HassanSyed Nasir Mehmood ShahAli Ahmadian","2022","http://link.springer.com/article/10.1007/s12083-021-01218-y","Article"
"Smart Cities and Smart Governance","Public Administration and Information Technology","","","","10.1007/978-3-030-61033-3","Elsa EstevezTheresa A. PardoProf. Hans Jochen Scholl","2021","http://link.springer.com/book/10.1007/978-3-030-61033-3","Book"
"Intelligent Transport Systems","Lecture Notes of the Institute for Computer Sciences, Social Informatics and Telecommunications Engineering","","","","10.1007/978-3-030-97603-3","Ana Lúcia MartinsJoao C FerreiraAlexander Kocian","2022","http://link.springer.com/book/10.1007/978-3-030-97603-3","Book"
"Runtime Verification","Lecture Notes in Computer Science","","","","10.1007/978-3-030-88494-9","Ph.D. Lu FengDr. Dana Fisman","2021","http://link.springer.com/book/10.1007/978-3-030-88494-9","Book"
"Clood CBR: Towards Microservices Oriented Case-Based Reasoning","Case-Based Reasoning Research and Development","","","","10.1007/978-3-030-58342-2_9","Ikechukwu Nkisi-OrjiNirmalie WiratungaChamath PalihawadanaJuan A. Recio-GarcíaDavid Corsar","2020","http://link.springer.com/chapter/10.1007/978-3-030-58342-2_9","Chapter"
"An Elastic Software Architecture for Extreme-Scale Big Data Analytics","Technologies and Applications for Big Data Value","","","","10.1007/978-3-030-78307-5_5","Maria A. SerranoCésar A. MarínAnna QueraltCristovao CordeiroMarco GonzalezLuis Miguel PinhoEduardo Quiñones","2022","http://link.springer.com/chapter/10.1007/978-3-030-78307-5_5","Chapter"
"Artificial Intelligence for Cloud and Edge Computing","Internet of Things","","","","10.1007/978-3-030-80821-1","Prof. Sanjay MisraProf. Amit Kumar TyagiProf. Vincenzo PiuriLalit Garg","2022","http://link.springer.com/book/10.1007/978-3-030-80821-1","Book"
"Deploying and Running Microservices","Microservices From Day One","","","","10.1007/978-1-4842-1937-9_10","Cloves Carneiro Jr.Tim Schmelmer","2016","http://link.springer.com/chapter/10.1007/978-1-4842-1937-9_10","Chapter"
"AI and Blockchain Technology in 6G Wireless Network","Blockchain Technologies","","","","10.1007/978-981-19-2868-0","Dr. Malaya Dutta BorahDr. Pushpa SinghDr. Ganesh Chandra Deka","2022","http://link.springer.com/book/10.1007/978-981-19-2868-0","Book"
"ERP Future Trends","Compendium on Enterprise Resource Planning","","","","10.1007/978-3-030-93856-7_3","Siar Sarferaz","2022","http://link.springer.com/chapter/10.1007/978-3-030-93856-7_3","Chapter"
"Product Lifecycle Management. Green and Blue Technologies to Support Smart and Sustainable Organizations","IFIP Advances in Information and Communication Technology","","","","10.1007/978-3-030-94399-8","Prof. Osiris Canciglieri JuniorProf. Frédéric NoëlLouis RivestProf. Dr. Abdelaziz Bouras","2022","http://link.springer.com/book/10.1007/978-3-030-94399-8","Book"
"Human Centred Intelligent Systems","Smart Innovation, Systems and Technologies","","","","10.1007/978-981-16-3264-8","Prof. Dr. Alfred ZimmermannProf. Robert J. HowlettProf. Lakhmi C. JainProf. Rainer Schmidt","2021","http://link.springer.com/book/10.1007/978-981-16-3264-8","Book"
"Deep Dive Into Microservices Development with Java","Rapid Java Persistence and Microservices","","","","10.1007/978-1-4842-4476-0_6","Raj Malhotra","2019","http://link.springer.com/chapter/10.1007/978-1-4842-4476-0_6","Chapter"
"Demystifying the Azure Well-Architected Framework","","","","","10.1007/978-1-4842-7119-3","Shijimol Ambi Karthikeyan","2021","http://link.springer.com/book/10.1007/978-1-4842-7119-3","Book"
"Principles for Security","Safety and Security of Cyber-Physical Systems","","","","10.1007/978-3-658-37182-1_11","Frank J. Furrer","2022","http://link.springer.com/chapter/10.1007/978-3-658-37182-1_11","Chapter"
"Design and Deploy Microsoft Azure Virtual Desktop","","","","","10.1007/978-1-4842-7796-6","Puthiyavan Udayakumar","2022","http://link.springer.com/book/10.1007/978-1-4842-7796-6","Book"
"Towards Greener Applications: Enabling Sustainable-aware Cloud Native Applications Design","Advanced Information Systems Engineering","","","","10.1007/978-3-031-07472-1_6","Monica Vitali","2022","http://link.springer.com/chapter/10.1007/978-3-031-07472-1_6","Chapter"
"Bio-inspired Systems and Applications: from Robotics to Ambient Intelligence","Lecture Notes in Computer Science","","","","10.1007/978-3-031-06527-9","José Manuel Ferrández VicenteJosé Ramón Álvarez-SánchezFélix de la Paz LópezHojjat Adeli","2022","http://link.springer.com/book/10.1007/978-3-031-06527-9","Book"
"Migrating the INTO-CPS Application to the Cloud","Formal Methods. FM 2019 International Workshops","","","","10.1007/978-3-030-54997-8_17","Hugo Daniel MacedoMikkel Bayard RasmussenCasper ThulePeter Gorm Larsen","2020","http://link.springer.com/chapter/10.1007/978-3-030-54997-8_17","Chapter"
"Formal Software Architectural Migration Towards Emerging Architectural Styles","Software Architecture","","","","10.1007/978-3-030-58923-3_2","Nacha ChondamrongkulJing SunIan Warren","2020","http://link.springer.com/chapter/10.1007/978-3-030-58923-3_2","Chapter"
"A Holistic View of Software and Hardware Reuse","Studies in Systems, Decision and Control","","","","10.1007/978-3-030-72261-6","Prof. Dr. Fevzi BelliDr. Ferdinand Quella","2021","http://link.springer.com/book/10.1007/978-3-030-72261-6","Book"
"Agile Product and Project Management","","","","","10.1007/978-1-4842-8200-7","Mariya Breyter","2022","http://link.springer.com/book/10.1007/978-1-4842-8200-7","Book"
"VLSI, Microwave and Wireless Technologies","Lecture Notes in Electrical Engineering","","","","10.1007/978-981-19-0312-0","Brijesh MishraManish Tiwari","2023","http://link.springer.com/book/10.1007/978-981-19-0312-0","Book"
"Special Topics","Future-Proof Software-Systems","","","","10.1007/978-3-658-19938-8_10","Frank J. Furrer","2019","http://link.springer.com/chapter/10.1007/978-3-658-19938-8_10","Chapter"
"Pro Windows Subsystem for Linux (WSL)","","","","","10.1007/978-1-4842-6873-5","Hayden Barnes","2021","http://link.springer.com/book/10.1007/978-1-4842-6873-5","Book"
"Mobile Internet Security","Communications in Computer and Information Science","","","","10.1007/978-981-16-9576-6","Prof. Ilsun YouHwankuk KimTaek-Young YounProf. Francesco PalmieriProf. Dr. Igor Kotenko","2022","http://link.springer.com/book/10.1007/978-981-16-9576-6","Book"
"Optimization Design of Privacy Protection System Based on Cloud Native","Advances in Artificial Intelligence and Security","","","","10.1007/978-3-031-06761-7_48","Yifan ZhangShuli ZhangChengyun GuoLuogang ZhangYinggang SunHai Huang","2022","http://link.springer.com/chapter/10.1007/978-3-031-06761-7_48","Chapter"
"Business Process Management","Lecture Notes in Computer Science","","","","10.1007/978-3-030-58666-9","Dirk FahlandChiara GhidiniProf. Dr. Jörg BeckerProf. Marlon Dumas","2020","http://link.springer.com/book/10.1007/978-3-030-58666-9","Book"
"Introduction to Cloud Native Architecture","Cloud Native Architecture and Design","","","","10.1007/978-1-4842-7226-8_1","Shivakumar R Goniwada","2022","http://link.springer.com/chapter/10.1007/978-1-4842-7226-8_1","Chapter"
"Event-Driven Architecture","Cloud Native Architecture and Design","","","","10.1007/978-1-4842-7226-8_6","Shivakumar R Goniwada","2022","http://link.springer.com/chapter/10.1007/978-1-4842-7226-8_6","Chapter"
"The Palgrave Handbook of Service Management","","","","","10.1007/978-3-030-91828-6","Bo EdvardssonBård Tronvoll","2022","http://link.springer.com/book/10.1007/978-3-030-91828-6","Book"
"Server Side","Rust for the IoT","","","","10.1007/978-1-4842-5860-6_2","Joseph Faisal Nusairat","2020","http://link.springer.com/chapter/10.1007/978-1-4842-5860-6_2","Chapter"
"Infrastructure-as-Code Automation Using Terraform, Packer, Vault, Nomad and Consul","","","","","10.1007/978-1-4842-7129-2","Navin SabharwalSarvesh PandeyPiyush Pandey","2021","http://link.springer.com/book/10.1007/978-1-4842-7129-2","Book"
"Development of an industrial Internet of things suite for smart factory towards re-industrialization","Advances in Manufacturing","","5","4","10.1007/s40436-017-0197-2","C. K. M. LeeS. Z. ZhangK. K. H. Ng","2017","http://link.springer.com/article/10.1007/s40436-017-0197-2","Article"
"Dynamics in Logistics","","","","","10.1007/978-3-030-88662-2","Prof. Dr. Michael FreitagProf. Dr. Herbert KotzabProf. Dr. Nicole Megow","2021","http://link.springer.com/book/10.1007/978-3-030-88662-2","Book"
"Advances in Production Management Systems. Artificial Intelligence for Sustainable and Resilient Production Systems","IFIP Advances in Information and Communication Technology","","","","10.1007/978-3-030-85910-7","Alexandre DolguiProf. Alain BernardDavid LemoineGregor von CieminskiDavid Romero","2021","http://link.springer.com/book/10.1007/978-3-030-85910-7","Book"
"Cloud-Transformation","","","","","10.1007/978-3-658-27325-5","Prof. Dr. Roland FrankGregor SchumacherAndreas Tamm","2019","http://link.springer.com/book/10.1007/978-3-658-27325-5","Book"
"Innovation Through Information Systems","Lecture Notes in Information Systems and Organisation","","","","10.1007/978-3-030-86797-3","Prof. Dr. Frederik AhlemannProf. Dr. Reinhard SchütteProf. Dr. Stefan Stieglitz","2021","http://link.springer.com/book/10.1007/978-3-030-86797-3","Book"
"Hands-on AIOps","","","","","10.1007/978-1-4842-8267-0","Navin SabharwalGaurav Bhardwaj","2022","http://link.springer.com/book/10.1007/978-1-4842-8267-0","Book"
"Agile Testing","","","","","10.1007/978-3-030-73209-7","Manfred BaumgartnerMartin KlonkChristian MastnakHelmut PichlerRichard SeidlSiegfried Tanczos","2021","http://link.springer.com/book/10.1007/978-3-030-73209-7","Book"
"Provenance and Annotation of Data and Processes","Lecture Notes in Computer Science","","","","10.1007/978-3-642-17819-1","Deborah L. McGuinnessJames R. MichaelisLuc Moreau","2010","http://link.springer.com/book/10.1007/978-3-642-17819-1","Book"
"From Code Refactoring to API Refactoring: Agile Service Design and Evolution","Service-Oriented Computing","","","","10.1007/978-3-030-87568-8_11","Mirko StockerOlaf Zimmermann","2021","http://link.springer.com/chapter/10.1007/978-3-030-87568-8_11","Chapter"
"Information and Communication Technologies in Education, Research, and Industrial Applications","Communications in Computer and Information Science","","","","10.1007/978-3-030-77592-6","Prof. Dr. Andreas BollinVadim ErmolayevHeinrich C. MayrProf. Dr. Mykola NikitchenkoAleksander SpivakovskyMykola TkachukVitaliy YakovynaGrygoriy Zholtkevych","2021","http://link.springer.com/book/10.1007/978-3-030-77592-6","Book"
"Building Solutions in the Azure Cloud","Cloud Debugging and Profiling in Microsoft Azure","","","","10.1007/978-1-4842-5437-0_1","Jeffrey ChilbertoSjoukje ZaalGaurav AroraaEd Price","2020","http://link.springer.com/chapter/10.1007/978-1-4842-5437-0_1","Chapter"
"SeCoS: Web of Things platform based on a microservices architecture and support of time-awareness","e & i Elektrotechnik und Informationstechnik","","133","3","10.1007/s00502-016-0404-z","Herwig ZeinerMichael GollerVíctor Juan Expósito JiménezFlorian SalmhoferWerner Haas","2016","http://link.springer.com/article/10.1007/s00502-016-0404-z","Article"
"Test them all, is it worth it? Assessing configuration sampling on the JHipster Web development stack","Empirical Software Engineering","","24","2","10.1007/s10664-018-9635-4","Axel HalinAlexandre NuttinckMathieu AcherXavier DevroeyGilles PerrouinBenoit Baudry","2019","http://link.springer.com/article/10.1007/s10664-018-9635-4","Article"
"Migration of existing software systems to mobile computing platforms: a systematic mapping study","Frontiers of Computer Science","","15","2","10.1007/s11704-019-8166-5","Ibrahim AlseadoonAakash AhmadAdel AlkhalilKhalid Sultan","2020","http://link.springer.com/article/10.1007/s11704-019-8166-5","Article"
"Advances in the Human Side of Service Engineering","Lecture Notes in Networks and Systems","","","","10.1007/978-3-030-80840-2","Dr. Christine LeitnerWalter GanzDebra SatterfieldClara Bassano","2021","http://link.springer.com/book/10.1007/978-3-030-80840-2","Book"
"Emerging Research in Intelligent Systems","Lecture Notes in Networks and Systems","","","","10.1007/978-3-030-96043-8","Dr. Miguel Botto-TobarHenry CruzAngela Díaz CadenaBenjamin Durakovic","2022","http://link.springer.com/book/10.1007/978-3-030-96043-8","Book"
"A Scalable Platform for Monitoring Data Intensive Applications","Journal of Grid Computing","","17","3","10.1007/s10723-019-09483-1","Ioan DrăganGabriel IuhaszDana Petcu","2019","http://link.springer.com/article/10.1007/s10723-019-09483-1","Article"
"Traefik for Microservices","Traefik API Gateway for Microservices","","","","10.1007/978-1-4842-6376-1_6","Rahul SharmaAkshay Mathur","2021","http://link.springer.com/chapter/10.1007/978-1-4842-6376-1_6","Chapter"
"Information Support of Scientific Researches of Virtual Communities on the Platform of Cloud Services","Advances in Intelligent Systems and Computing III","","","","10.1007/978-3-030-01069-0_22","Kazarian ArtemRoman HoloshchukNataliia KunanetsTetiana ShestakevyshAntonii Rzheuskyi","2019","http://link.springer.com/chapter/10.1007/978-3-030-01069-0_22","Chapter"
"Risk and Complexity Assessment on the Context of Language Migration","Quality of Information and Communications Technology","","","","10.1007/978-3-030-85347-1_8","Santiago BragagnoloAbderrahmane SeriaiStéphane DucasseMustapha Derras","2021","http://link.springer.com/chapter/10.1007/978-3-030-85347-1_8","Chapter"
"Service Automation in the Public Sector","Progress in IS","","","","10.1007/978-3-030-92644-1","Assoc. Prof. Gustaf Juell-SkielseDr. Ida LindgrenDr. Maria Åkesson","2022","http://link.springer.com/book/10.1007/978-3-030-92644-1","Book"
"Mobile Web and Intelligent Information Systems","Lecture Notes in Computer Science","","","","10.1007/978-3-030-83164-6","Jamal BentaharProf. Irfan AwanMuhammad YounasTor-Morten Grønli","2021","http://link.springer.com/book/10.1007/978-3-030-83164-6","Book"
"Advances in Computing and Data Sciences","Communications in Computer and Information Science","","","","10.1007/978-3-031-12638-3","Mayank SinghDr. Vipin TyagiDr. P. K. GuptaProf. Jan FlusserTuncer Ören","2022","http://link.springer.com/book/10.1007/978-3-031-12638-3","Book"
"Discovering Microservices in Enterprise Systems Using a Business Object Containment Heuristic","On the Move to Meaningful Internet Systems. OTM 2018 Conferences","","","","10.1007/978-3-030-02671-4_4","Adambarage Anuruddha Chathuranga De AlwisAlistair BarrosColin FidgeArtem Polyvyanyy","2018","http://link.springer.com/chapter/10.1007/978-3-030-02671-4_4","Chapter"
"ICWE 2021 Workshops","Communications in Computer and Information Science","","","","10.1007/978-3-030-92231-3","Maxim BakaevProf. In-Young KoMichael MrissaProf. Cesare PautassoAbhishek Srivastava","2022","http://link.springer.com/book/10.1007/978-3-030-92231-3","Book"
"Future Networks, Services and Management","","","","","10.1007/978-3-030-81961-3","Dr. Mehmet Toy","2021","http://link.springer.com/book/10.1007/978-3-030-81961-3","Book"
"CAVAS: Neutralizing Application and Container Security Vulnerabilities in the Cloud Native Era","Security and Privacy in Communication Networks","","","","10.1007/978-3-030-01701-9_26","Kennedy A. TorkuraMuhammad I. H. SukmanaFeng ChengChristoph Meinel","2018","http://link.springer.com/chapter/10.1007/978-3-030-01701-9_26","Chapter"
"Service Fabric","Microservices, IoT, and Azure","","","","10.1007/978-1-4842-1275-2_8","Bob Familiar","2015","http://link.springer.com/chapter/10.1007/978-1-4842-1275-2_8","Chapter"
"Software Architecture: Past, Present, Future","The Essence of Software Engineering","","","","10.1007/978-3-319-73897-0_10","Wilhelm Hasselbring","2018","http://link.springer.com/chapter/10.1007/978-3-319-73897-0_10","Chapter"
"API Development","API Marketplace Engineering","","","","10.1007/978-1-4842-7313-5_8","Rennay Dorasamy","2022","http://link.springer.com/chapter/10.1007/978-1-4842-7313-5_8","Chapter"
"A Well-Rounded Engineer","Learn Rails 6","","","","10.1007/978-1-4842-6026-5_10","Adam Notodikromo","2021","http://link.springer.com/chapter/10.1007/978-1-4842-6026-5_10","Chapter"
"Security and Privacy in Cyberspace","Blockchain Technologies","","","","10.1007/978-981-19-1960-2","Omprakash KaiwartyaKeshav KaushikSachin Kumar GuptaAshutosh MishraManoj Kumar","2022","http://link.springer.com/book/10.1007/978-981-19-1960-2","Book"
"Die digitale Transformation der Automobilindustrie","","","","","10.1007/978-3-662-62102-8","Dr. Uwe Winkelhake","2021","http://link.springer.com/book/10.1007/978-3-662-62102-8","Book"
"Terahertz Devices, Circuits and Systems","","","","","10.1007/978-981-19-4105-4","Sudipta DasAnveshkumar NellaShobhit K. Patel","2022","http://link.springer.com/book/10.1007/978-981-19-4105-4","Book"
"From Agile Development to DevOps: Going Towards Faster Releases at High Quality – Experiences from an Industrial Context","Software Quality. Complexity and Challenges of Software Engineering in Emerging Technologies","","","","10.1007/978-3-319-49421-0_3","Frank ElberzhagerTaslim ArifMatthias NaabInge SüßSener Koban","2017","http://link.springer.com/chapter/10.1007/978-3-319-49421-0_3","Chapter"
"Anomaly Detection and Diagnosis for Container-Based Microservices with Performance Monitoring","Algorithms and Architectures for Parallel Processing","","","","10.1007/978-3-030-05063-4_42","Qingfeng DuTiandi XieYu He","2018","http://link.springer.com/chapter/10.1007/978-3-030-05063-4_42","Chapter"
"GranMicro: A Black-Box Based Approach for Optimizing Microservices Based Applications","From Science to Society","","","","10.1007/978-3-319-65687-8_25","Ola MustafaJorge Marx GómezMohamad HamedHergen Pargmann","2018","http://link.springer.com/chapter/10.1007/978-3-319-65687-8_25","Chapter"
"Data Teams","","","","","10.1007/978-1-4842-6228-3","Jesse Anderson","2020","http://link.springer.com/book/10.1007/978-1-4842-6228-3","Book"
"Comparison of End-to-End Testing Tools for Microservices: A Case Study","Information Technology and Systems","","","","10.1007/978-3-030-68285-9_39","Cristian Martínez HernándezAlexandra MartínezChristian Quesada-LópezMarcelo Jenkins","2021","http://link.springer.com/chapter/10.1007/978-3-030-68285-9_39","Chapter"
"Data Analytics: Predicting Software Bugs in Industrial Products","System Dependability and Analytics","","","","10.1007/978-3-031-02063-6_3","Robert HanmerVeena Mendiratta","2023","http://link.springer.com/chapter/10.1007/978-3-031-02063-6_3","Chapter"
"A Service-Oriented Framework for ETL Implementation","Progress in Artificial Intelligence","","","","10.1007/978-3-031-16474-3_52","Bruno OliveiraMário LeiteÓscar OliveiraOrlando Belo","2022","http://link.springer.com/chapter/10.1007/978-3-031-16474-3_52","Chapter"
"MicroFinTech","Palgrave Studies in Financial Services Technology","","","","10.1007/978-3-030-80394-0","Dr. Roberto Moro-Visconti","2021","http://link.springer.com/book/10.1007/978-3-030-80394-0","Book"
"The SaaS System in Question","Migrating ASP.NET Microservices to ASP.NET Core","","","","10.1007/978-1-4842-4327-5_1","Iris Classon","2019","http://link.springer.com/chapter/10.1007/978-1-4842-4327-5_1","Chapter"
"Design-Time to Run-Time Verification of Microservices Based Applications","Software Engineering and Formal Methods","","","","10.1007/978-3-319-74781-1_12","Matteo CamilliCarlo BellettiniLorenzo Capra","2018","http://link.springer.com/chapter/10.1007/978-3-319-74781-1_12","Chapter"
