Item Title,Publication Title,Book Series Title,Journal Volume,Journal Issue,Item DOI,Authors,Publication Year,URL,Content Type
"Practical Event-Driven Microservices Architecture","","","","","10.1007/978-1-4842-7468-2","Hugo Filipe Oliveira Rocha","2022","http://link.springer.com/book/10.1007/978-1-4842-7468-2","Book"
"Cloud Native Architecture and Design","","","","","10.1007/978-1-4842-7226-8","Shivakumar R Goniwada","2022","http://link.springer.com/book/10.1007/978-1-4842-7226-8","Book"
"Service-Oriented Computing","Lecture Notes in Computer Science","","","","10.1007/978-3-030-91431-8","Hakim HacidOdej KaoMassimo MecellaDr. Naouel MohaHye-young Paik","2021","http://link.springer.com/book/10.1007/978-3-030-91431-8","Book"
"Systems, Software and Services Process Improvement","Communications in Computer and Information Science","","","","10.1007/978-3-031-15559-8","Murat YilmazPaul ClarkeRichard MessnarzBruno Wöran","2022","http://link.springer.com/book/10.1007/978-3-031-15559-8","Book"
"Pro Microservices in .NET 6","","","","","10.1007/978-1-4842-7833-8","Sean WhitesellRob RichardsonMatthew D. Groves","2022","http://link.springer.com/book/10.1007/978-1-4842-7833-8","Book"
"Pro Java Microservices with Quarkus and Kubernetes","","","","","10.1007/978-1-4842-7170-4","Nebrass Lamouchi","2021","http://link.springer.com/book/10.1007/978-1-4842-7170-4","Book"
"Advanced Information Systems Engineering","Lecture Notes in Computer Science","","","","10.1007/978-3-030-79382-1","Marcello La RosaShazia SadiqProf. Ernest Teniente","2021","http://link.springer.com/book/10.1007/978-3-030-79382-1","Book"
"On the Migration to and Synthesis of (Micro-)services: The Use of Intelligent Techniques","Next-Gen Digital Services. A Retrospective and Roadmap for Service Computing of the Future","","","","10.1007/978-3-030-73203-5_4","Andreas S. AndreouAndreas Christoforou","2021","http://link.springer.com/chapter/10.1007/978-3-030-73203-5_4","Chapter"
"From Monolith to Microservice","Designing Microservices with Django","","","","10.1007/978-1-4842-5358-8_5","Akos Hochrein","2019","http://link.springer.com/chapter/10.1007/978-1-4842-5358-8_5","Chapter"
"Software Technologies","Communications in Computer and Information Science","","","","10.1007/978-3-031-11513-4","Prof. Dr. Hans-Georg FillDr. Marten van SinderenProf. Leszek A. Maciaszek","2022","http://link.springer.com/book/10.1007/978-3-031-11513-4","Book"
"Service-Oriented Computing  – ICSOC 2020 Workshops","Lecture Notes in Computer Science","","","","10.1007/978-3-030-76352-7","Hakim HacidFatma OutayHye-young PaikAmira AlloumMarinella PetrocchiMohamed Reda BouadjenekDr. Amin BeheshtiXumin LiuAbderrahmane Maaradji","2021","http://link.springer.com/book/10.1007/978-3-030-76352-7","Book"
"Materializing Microservice-oriented Architecture from Monolithic Object-oriented Source Code","Software Technologies","","","","10.1007/978-3-031-11513-4_7","Pascal ZaragozaAbdelhak-Djamel SeriaiAbderrahmane SeriaiAnas ShatnawiHinde-Lilia BouzianeMustapha Derras","2022","http://link.springer.com/chapter/10.1007/978-3-031-11513-4_7","Chapter"
"Product-Focused Software Process Improvement","Lecture Notes in Computer Science","","","","10.1007/978-3-030-91452-3","Luca ArditoAndreas JedlitschkaDr. Maurizio MorisioProf. Marco Torchiano","2021","http://link.springer.com/book/10.1007/978-3-030-91452-3","Book"
"Software Architecture","Lecture Notes in Computer Science","","","","10.1007/978-3-030-86044-8","Univ.-Prof. Dr. Stefan BifflElena NavarroWelf LöweProf. Marjan SirjaniProf. Raffaela MirandolaProf. Dr. Danny Weyns","2021","http://link.springer.com/book/10.1007/978-3-030-86044-8","Book"
"Software Architecture","Lecture Notes in Computer Science","","","","10.1007/978-3-031-16697-6","Ilias GerostathopoulosGrace LewisThais BatistaTomáš Bureš","2022","http://link.springer.com/book/10.1007/978-3-031-16697-6","Book"
"Migrating from Monoliths to Cloud-Based Microservices: A Banking Industry Example","Software Engineering in the Era of Cloud Computing","","","","10.1007/978-3-030-33624-0_4","Alan MegargelVenky ShankararamanDavid K. Walker","2020","http://link.springer.com/chapter/10.1007/978-3-030-33624-0_4","Chapter"
"Computational Science and Its Applications – ICCSA 2022","Lecture Notes in Computer Science","","","","10.1007/978-3-031-10522-7","Prof. Dr. Osvaldo GervasiBeniamino MurganteEligius M. T. HendrixDavid TaniarProf. Bernady O. Apduhan","2022","http://link.springer.com/book/10.1007/978-3-031-10522-7","Book"
"Future Intent-Based Networking","Lecture Notes in Electrical Engineering","","","","10.1007/978-3-030-92435-5","Prof. Dr. Mikhailo KlymashProf. Mykola BeshleyProf. Dr. Andriy Luntovskyy","2022","http://link.springer.com/book/10.1007/978-3-030-92435-5","Book"
"Azure Kubernetes Services with Microservices","","","","","10.1007/978-1-4842-7809-3","Kasam Ahmed ShaikhShailesh S. Agaskar","2022","http://link.springer.com/book/10.1007/978-1-4842-7809-3","Book"
"Product-Focused Software Process Improvement","Lecture Notes in Computer Science","","","","10.1007/978-3-030-35333-9","Prof. Dr. Xavier FranchTomi MännistöSilverio Martínez-Fernández","2019","http://link.springer.com/book/10.1007/978-3-030-35333-9","Book"
"From Monolith to Microservices: A Classification of Refactoring Approaches","Software Engineering Aspects of Continuous Development and New Paradigms of Software Production and Deployment","","","","10.1007/978-3-030-06019-0_10","Jonas FritzschJustus BognerAlfred ZimmermannStefan Wagner","2019","http://link.springer.com/chapter/10.1007/978-3-030-06019-0_10","Chapter"
"Web Engineering","Lecture Notes in Computer Science","","","","10.1007/978-3-030-74296-6","Ph.D. Marco BrambillaProf. Richard ChbeirFlavius FrasincarDr. Ioana Manolescu","2021","http://link.springer.com/book/10.1007/978-3-030-74296-6","Book"
"Tool Support for the Migration to Microservice Architecture: An Industrial Case Study","Software Architecture","","","","10.1007/978-3-030-29983-5_17","Ilaria PigazziniFrancesca Arcelli FontanaAndrea Maggioni","2019","http://link.springer.com/chapter/10.1007/978-3-030-29983-5_17","Chapter"
"Systems, Software and Services Process Improvement","Communications in Computer and Information Science","","","","10.1007/978-3-030-85521-5","Murat YilmazPaul ClarkeDr. Richard MessnarzProf. Michael Reiner","2021","http://link.springer.com/book/10.1007/978-3-030-85521-5","Book"
"Assessing Your Microservice Migration","Microservices","","","","10.1007/978-3-030-31646-4_4","Alexis HenryYoussef Ridene","2020","http://link.springer.com/chapter/10.1007/978-3-030-31646-4_4","Chapter"
"Proceedings of the Future Technologies Conference (FTC) 2021, Volume 3","Lecture Notes in Networks and Systems","","","","10.1007/978-3-030-89912-7","Prof. Dr. Kohei Arai","2022","http://link.springer.com/book/10.1007/978-3-030-89912-7","Book"
"Performance Analysis of Monolithic and Micro Service Architectures – Containers Technology","Trends and Applications in Software Engineering","","","","10.1007/978-3-030-01171-0_25","Alexis SaransigFreddy Tapia","2019","http://link.springer.com/chapter/10.1007/978-3-030-01171-0_25","Chapter"
"ITNG 2022 19th International Conference on Information Technology-New Generations","Advances in Intelligent Systems and Computing","","","","10.1007/978-3-030-97652-1","Dr. Shahram Latifi","2022","http://link.springer.com/book/10.1007/978-3-030-97652-1","Book"
"Intelligent Systems Design and Applications","Lecture Notes in Networks and Systems","","","","10.1007/978-3-030-96308-8","Dr. Ajith AbrahamDr. Niketa GandhiDr. Thomas HanneDr. Tzung-Pei HongDr. Tatiane Nogueira RiosDr. Weiping Ding","2022","http://link.springer.com/book/10.1007/978-3-030-96308-8","Book"
"Serverless Software Engineering – and How to Get There.","Systems, Software and Services Process Improvement","","","","10.1007/978-3-031-15559-8_6","Stephen McAleeseJordan Conway McLaughlinFilip DetynaAndrey MurashevMurat YilmazPaul M. Clarke","2022","http://link.springer.com/chapter/10.1007/978-3-031-15559-8_6","Chapter"
"Product-Focused Software Process Improvement","Lecture Notes in Computer Science","","","","10.1007/978-3-030-64148-1","Dr. Maurizio MorisioProf. Marco TorchianoAndreas Jedlitschka","2020","http://link.springer.com/book/10.1007/978-3-030-64148-1","Book"
"Proceedings of Second International Conference on Sustainable Expert Systems","Lecture Notes in Networks and Systems","","","","10.1007/978-981-16-7657-4","Dr. Subarna ShakyaDr. Ke-Lin DuDr. Wang Haoxiang","2022","http://link.springer.com/book/10.1007/978-981-16-7657-4","Book"
"Advances in Information Systems Development","Lecture Notes in Information Systems and Organisation","","","","10.1007/978-3-030-95354-6","Dr. Emilio InsfranDr. Fernando GonzálezDr. Silvia AbrahãoDr. Marta FernándezDr. Chris BarryDr. Michael LangDr. Henry LingerDr. Christoph Schneider","2022","http://link.springer.com/book/10.1007/978-3-030-95354-6","Book"
"Advanced Information Networking and Applications","Lecture Notes in Networks and Systems","","","","10.1007/978-3-030-99587-4","Prof. Dr. Leonard BarolliProf. Farookh HussainProf. Tomoya Enokido","2022","http://link.springer.com/book/10.1007/978-3-030-99587-4","Book"
"Encyclopedia of Database Systems","","","","","10.1007/978-1-4614-8265-9","Ling LiuM. Tamer Özsu","2018","http://link.springer.com/referencework/10.1007/978-1-4614-8265-9","ReferenceWork"
"Embracing Event-Driven Architectures","Practical Event-Driven Microservices Architecture","","","","10.1007/978-1-4842-7468-2_1","Hugo Filipe Oliveira Rocha","2022","http://link.springer.com/chapter/10.1007/978-1-4842-7468-2_1","Chapter"
"Data Spaces","","","","","10.1007/978-3-030-98636-0","Edward CurrySimon ScerriTuomo Tuikka","2022","http://link.springer.com/book/10.1007/978-3-030-98636-0","Book"
"Proceedings of 3rd International Conference on Machine Learning, Advances in Computing, Renewable Energy and Communication","Lecture Notes in Electrical Engineering","","","","10.1007/978-981-19-2828-4","Anuradha TomarHasmat MalikPramod KumarAtif Iqbal","2022","http://link.springer.com/book/10.1007/978-981-19-2828-4","Book"
"Software Architecture","Lecture Notes in Computer Science","","","","10.1007/978-3-031-15116-3","Prof. Patrizia ScandurraMatthias GalsterProf. Raffaela MirandolaProf. Dr. Danny Weyns","2022","http://link.springer.com/book/10.1007/978-3-031-15116-3","Book"
"Continuous Architecting with Microservices and DevOps: A Systematic Mapping Study","Cloud Computing and Services Science","","","","10.1007/978-3-030-29193-8_7","Davide TaibiValentina LenarduzziClaus Pahl","2019","http://link.springer.com/chapter/10.1007/978-3-030-29193-8_7","Chapter"
"Architecting the Digital Transformation","Intelligent Systems Reference Library","","","","10.1007/978-3-030-49640-1","Prof. Alfred ZimmermannProf. Dr. Rainer SchmidtProf. Dr. Lakhmi C. Jain","2021","http://link.springer.com/book/10.1007/978-3-030-49640-1","Book"
"From a Monolith to a Microservices Architecture: An Approach Based on Transactional Contexts","Software Architecture","","","","10.1007/978-3-030-29983-5_3","Luís NunesNuno SantosAntónio Rito Silva","2019","http://link.springer.com/chapter/10.1007/978-3-030-29983-5_3","Chapter"
"Information Systems","Lecture Notes in Business Information Processing","","","","10.1007/978-3-030-95947-0","Prof. Marinos ThemistocleousDr. Maria Papadaki","2022","http://link.springer.com/book/10.1007/978-3-030-95947-0","Book"
"Banking 4.0","","","","","10.1007/978-981-16-6069-6","Mohan Bhatia","2022","http://link.springer.com/book/10.1007/978-981-16-6069-6","Book"
"Moving from a Monolith to an Event-Driven Architecture","Practical Event-Driven Microservices Architecture","","","","10.1007/978-1-4842-7468-2_2","Hugo Filipe Oliveira Rocha","2022","http://link.springer.com/chapter/10.1007/978-1-4842-7468-2_2","Chapter"
"Migrating to Microservices","Microservices","","","","10.1007/978-3-030-31646-4_3","Alexis HenryYoussef Ridene","2020","http://link.springer.com/chapter/10.1007/978-3-030-31646-4_3","Chapter"
"Microscope: Pinpoint Performance Issues with Causal Graphs in Micro-service Environments","Service-Oriented Computing","","","","10.1007/978-3-030-03596-9_1","Jinjin LinPengfei ChenZibin Zheng","2018","http://link.springer.com/chapter/10.1007/978-3-030-03596-9_1","Chapter"
"Intelligent Distributed Computing XIV","Studies in Computational Intelligence","","","","10.1007/978-3-030-96627-0","David CamachoProf. Domenico RosaciProf. Giuseppe M. L. SarnéMario Versaci","2022","http://link.springer.com/book/10.1007/978-3-030-96627-0","Book"
"The Digital Journey of Banking and Insurance, Volume III","","","","","10.1007/978-3-030-78821-6","Volker LiermannClaus Stegmann","2021","http://link.springer.com/book/10.1007/978-3-030-78821-6","Book"
"On the Move to Meaningful Internet Systems: OTM 2019 Conferences","Lecture Notes in Computer Science","","","","10.1007/978-3-030-33246-4","Hervé PanettoChristophe DebruyneMartin HeppDave LewisDr. Claudio Agostino ArdagnaRobert Meersman","2019","http://link.springer.com/book/10.1007/978-3-030-33246-4","Book"
"Advanced Information Networking and Applications","Lecture Notes in Networks and Systems","","","","10.1007/978-3-030-99619-2","Prof. Dr. Leonard BarolliProf. Farookh HussainProf. Tomoya Enokido","2022","http://link.springer.com/book/10.1007/978-3-030-99619-2","Book"
"An Experience Report from the Migration of Legacy Software Systems to Microservice Based Architecture","16th International Conference on Information Technology-New Generations (ITNG 2019)","","","","10.1007/978-3-030-14070-0_26","Hugo Henrique S. da SilvaGlauco de F. CarneiroMiguel P. Monteiro","2019","http://link.springer.com/chapter/10.1007/978-3-030-14070-0_26","Chapter"
"Performance optimization for cloud computing systems in the microservice era: state-of-the-art and research opportunities","Frontiers of Computer Science","","16","6","10.1007/s11704-020-0072-3","Rong ZengXiaofeng HouLu ZhangChao LiWenli ZhengMinyi Guo","2022","http://link.springer.com/article/10.1007/s11704-020-0072-3","Article"
"Smart and Sustainable Collaborative Networks 4.0","IFIP Advances in Information and Communication Technology","","","","10.1007/978-3-030-85969-5","Prof. Dr. Luis M. Camarinha-MatosProf. Dr. Xavier BoucherProf. Dr. Hamideh Afsarmanesh","2021","http://link.springer.com/book/10.1007/978-3-030-85969-5","Book"
"Technologies and Applications for Big Data Value","","","","","10.1007/978-3-030-78307-5","Dr. Edward CurryProf. Dr. Sören AuerDr. Arne J. BerreDr. Andreas MetzgerProf. Maria S. PerezProf. Sonja Zillner","2022","http://link.springer.com/book/10.1007/978-3-030-78307-5","Book"
"Microservices Backlog - A Model of Granularity Specification and Microservice Identification","Services Computing – SCC 2020","","","","10.1007/978-3-030-59592-0_6","Fredy H. Vera-RiveraEduard G. Puerto-CuadrosHernán AstudilloCarlos Mauricio Gaona-Cuevas","2020","http://link.springer.com/chapter/10.1007/978-3-030-59592-0_6","Chapter"
"Intelligent Systems and Applications","Lecture Notes in Networks and Systems","","","","10.1007/978-3-030-82193-7","Prof. Dr. Kohei Arai","2022","http://link.springer.com/book/10.1007/978-3-030-82193-7","Book"
"Emerging Research in Computing, Information, Communication and Applications","Lecture Notes in Electrical Engineering","","","","10.1007/978-981-16-1342-5","Prof. N. R. ShettyProf. L. M. PatnaikProf. H. C. NagarajDr. Prasad N. HamsavathDr. N. Nalini","2022","http://link.springer.com/book/10.1007/978-981-16-1342-5","Book"
"Innovations for Community Services","Communications in Computer and Information Science","","","","10.1007/978-3-031-06668-9","Frank PhillipsonGerald EichlerProf. Dr. Christian ErfurthGünter Fahrnberger","2022","http://link.springer.com/book/10.1007/978-3-031-06668-9","Book"
"Advances in Enterprise Engineering XV","Lecture Notes in Business Information Processing","","","","10.1007/978-3-031-11520-2","Prof. David AveiroHenderik A. ProperSérgio GuerreiroDr. Marne de Vries","2022","http://link.springer.com/book/10.1007/978-3-031-11520-2","Book"
"Proceedings of International Conference on Communication and Computational Technologies","Algorithms for Intelligent Systems","","","","10.1007/978-981-16-3246-4","Dr. Sandeep KumarDr. Sunil Dutt PurohitDr. Saroj HiranwalDr. Mukesh Prasad","2021","http://link.springer.com/book/10.1007/978-981-16-3246-4","Book"
"The Adoption of Microservices Architecture as a Natural Consequence of Legacy System Migration at Police Intelligence Department","Computational Science and Its Applications – ICCSA 2022","","","","10.1007/978-3-031-10522-7_25","Murilo Góes de AlmeidaEdna Dias Canedo","2022","http://link.springer.com/chapter/10.1007/978-3-031-10522-7_25","Chapter"
"DoME: Dew computing based microservice execution in mobile edge using Q-learning","Applied Intelligence","","","","10.1007/s10489-022-04087-x","Sheuli ChakrabortyDebashis DeKaushik Mazumdar","2022","http://link.springer.com/article/10.1007/s10489-022-04087-x","Article"
"Handbook of Smart Cities","","","","","10.1007/978-3-030-69698-6","Juan Carlos Augusto","2021","http://link.springer.com/referencework/10.1007/978-3-030-69698-6","ReferenceWork"
"Software Architecture","Communications in Computer and Information Science","","","","10.1007/978-3-030-59155-7","Henry MucciniParis AvgeriouDr. Barbora BuhnovaJavier CamaraMauro CaporuscioMirco FranzagoAnne KoziolekDr. Patrizia ScandurraCatia TrubianiDanny WeynsUwe Zdun","2020","http://link.springer.com/book/10.1007/978-3-030-59155-7","Book"
"Encyclopedia of Database Systems","","","","","10.1007/978-0-387-39940-9","LING LIUM. TAMER ÖZSU","2009","http://link.springer.com/referencework/10.1007/978-0-387-39940-9","ReferenceWork"
"Migration of Monolithic Applications Towards Microservices Under the Vision of the Information Hiding Principle: A Systematic Mapping Study","Advances in Emerging Trends and Technologies","","","","10.1007/978-3-030-32022-5_9","Victor VelepuchaPamela FloresJenny Torres","2020","http://link.springer.com/chapter/10.1007/978-3-030-32022-5_9","Chapter"
"Facilitating the migration to the microservice architecture via model-driven reverse engineering and reinforcement learning","Software and Systems Modeling","","21","3","10.1007/s10270-022-00977-3","MohammadHadi DehghaniShekoufeh Kolahdouz-RahimiMassimo TisiDalila Tamzalit","2022","http://link.springer.com/article/10.1007/s10270-022-00977-3","Article"
"The Digital Transformation of the Automotive Industry","","","","","10.1007/978-3-030-83826-3","Dr. Uwe Winkelhake","2022","http://link.springer.com/book/10.1007/978-3-030-83826-3","Book"
"Emerging Trends in Intelligent Systems & Network Security","Lecture Notes on Data Engineering and Communications Technologies","","","","10.1007/978-3-031-15191-0","Mohamed Ben AhmedBoudhir Anouar AbdelhakimBernadetta Kwintiana AneDidi Rosiyadi","2023","http://link.springer.com/book/10.1007/978-3-031-15191-0","Book"
"Towards a Methodology to Form Microservices from Monolithic Ones","Euro-Par 2016: Parallel Processing Workshops","","","","10.1007/978-3-319-58943-5_23","Gabor KecskemetiAttila KerteszAttila Csaba Marosi","2017","http://link.springer.com/chapter/10.1007/978-3-319-58943-5_23","Chapter"
"Computer and Communication Engineering","Communications in Computer and Information Science","","","","10.1007/978-3-031-17422-3","Filippo NeriKe-Lin DuVijaya Kumar VaradarajanSan-Blas Angel-AntonioZhiyu Jiang","2022","http://link.springer.com/book/10.1007/978-3-031-17422-3","Book"
"Promises and challenges of microservices: an exploratory study","Empirical Software Engineering","","26","4","10.1007/s10664-020-09910-y","Yingying WangHarshavardhan KadiyalaJulia Rubin","2021","http://link.springer.com/article/10.1007/s10664-020-09910-y","Article"
"International Conference on Cognitive based Information Processing and Applications (CIPA 2021)","Lecture Notes on Data Engineering and Communications Technologies","","","","10.1007/978-981-16-5857-0","Bernard J. JansenHaibo LiangDr. Jun Ye","2022","http://link.springer.com/book/10.1007/978-981-16-5857-0","Book"
"Encyclopedia of Big Data Technologies","","","","","10.1007/978-3-319-77525-8","Sherif SakrAlbert Y. Zomaya","2019","http://link.springer.com/referencework/10.1007/978-3-319-77525-8","ReferenceWork"
"A Model-Driven Approach Towards Automatic Migration to Microservices","Software Engineering Aspects of Continuous Development and New Paradigms of Software Production and Deployment","","","","10.1007/978-3-030-39306-9_2","Antonio BucchiaroneKemal SoysalClaudio Guidi","2020","http://link.springer.com/chapter/10.1007/978-3-030-39306-9_2","Chapter"
"Euro-Par 2021: Parallel Processing Workshops","Lecture Notes in Computer Science","","","","10.1007/978-3-031-06156-1","Ricardo ChavesDora B. HerasAleksandar IlicDidem UnatRosa M. BadiaAndrea BraccialiPatrick DiehlDr. Anshu DubeyOh SangyoonStephen L. ScottLaura Ricci","2022","http://link.springer.com/book/10.1007/978-3-031-06156-1","Book"
"Determining Microservice Boundaries: A Case Study Using Static and Dynamic Software Analysis","Software Architecture","","","","10.1007/978-3-030-58923-3_21","Tiago MatiasFilipe F. CorreiaJonas FritzschJustus BognerHugo S. FerreiraAndré Restivo","2020","http://link.springer.com/chapter/10.1007/978-3-030-58923-3_21","Chapter"
"Advanced Information Systems Engineering","Lecture Notes in Computer Science","","","","10.1007/978-3-030-49435-3","Prof. Dr. Schahram DustdarDr. Eric YuCamille SalinesiDominique RieuVik Pant","2020","http://link.springer.com/book/10.1007/978-3-030-49435-3","Book"
"Computational Science and Its Applications – ICCSA 2022 Workshops","Lecture Notes in Computer Science","","","","10.1007/978-3-031-10548-7","Prof. Osvaldo GervasiBeniamino MurganteSanjay MisraAna Maria A. C. RochaDr. Chiara Garau","2022","http://link.springer.com/book/10.1007/978-3-031-10548-7","Book"
"Lecture Notes in Computational Intelligence and Decision Making","Lecture Notes on Data Engineering and Communications Technologies","","","","10.1007/978-3-030-82014-5","Prof. Sergii BabichevProf. Volodymyr Lytvynenko","2022","http://link.springer.com/book/10.1007/978-3-030-82014-5","Book"
"Service-Oriented Computing","Communications in Computer and Information Science","","","","10.1007/978-3-030-87568-8","Johanna Barzen","2021","http://link.springer.com/book/10.1007/978-3-030-87568-8","Book"
"Rising Threats in Expert Applications and Solutions","Lecture Notes in Networks and Systems","","","","10.1007/978-981-19-1122-4","Prof. Vijay Singh RathoreProf. Subhash Chander SharmaProf. Joao Manuel R.S. TavaresDr. Catarina MoreiraDr. B. Surendiran","2022","http://link.springer.com/book/10.1007/978-981-19-1122-4","Book"
"Cyber Security Intelligence and Analytics","Lecture Notes on Data Engineering and Communications Technologies","","","","10.1007/978-3-030-97874-7","Prof. Zheng XuSaed AlrabaeeDr. Octavio Loyola-GonzálezDr. Xiaolu ZhangNiken Dwi Wahyu CahyaniNurul Hidayah Ab Rahman","2022","http://link.springer.com/book/10.1007/978-3-030-97874-7","Book"
"Microservice-Based System for Environmental Science Software Applications","ITNG 2022 19th International Conference on Information Technology-New Generations","","","","10.1007/978-3-030-97652-1_39","Vinh LeConnor Scully AllisonMitchell MartinezSergiu M. DascaluFrederick C. Harris,Scotty D. StrachanEric Fritzinger","2022","http://link.springer.com/chapter/10.1007/978-3-030-97652-1_39","Chapter"
"API Marketplace Engineering","","","","","10.1007/978-1-4842-7313-5","Rennay Dorasamy","2022","http://link.springer.com/book/10.1007/978-1-4842-7313-5","Book"
"Proceedings of Second International Conference on Advances in Computer Engineering and Communication Systems","Algorithms for Intelligent Systems","","","","10.1007/978-981-16-7389-4","Dr. A. Brahmananda ReddyDr. B.V. KiranmayeeDr. Raghava Rao MukkamalaDr. K. Srujan Raju","2022","http://link.springer.com/book/10.1007/978-981-16-7389-4","Book"
"Highly-Distributed Systems","","","","","10.1007/978-3-030-92829-2","Prof. Dr. Andriy LuntovskyyDr. Dietbert Gütter","2022","http://link.springer.com/book/10.1007/978-3-030-92829-2","Book"
"Advanced Information Systems Engineering","Lecture Notes in Computer Science","","","","10.1007/978-3-031-07472-1","Prof. Dr. Xavier FranchGeert PoelsDr. Frederik GaillyMonique Snoeck","2022","http://link.springer.com/book/10.1007/978-3-031-07472-1","Book"
"Coordination Models and Languages","Lecture Notes in Computer Science","","","","10.1007/978-3-030-78142-2","Ferruccio DamianiDr. Ornela Dardha","2021","http://link.springer.com/book/10.1007/978-3-030-78142-2","Book"
"Safety and Security of Cyber-Physical Systems","","","","","10.1007/978-3-658-37182-1","Dr. Frank J. Furrer","2022","http://link.springer.com/book/10.1007/978-3-658-37182-1","Book"
"Patterns Related to Microservice Architecture: a Multivocal Literature Review","Programming and Computer Software","","46","8","10.1134/S0361768820080253","J. A. ValdiviaA. Lora-GonzálezX. LimónK. Cortes-VerdinJ.O. Ocharán-Hernández","2020","http://link.springer.com/article/10.1134/S0361768820080253","Article"
"A Decomposition and Metric-Based Evaluation Framework for Microservices","Cloud Computing and Services Science","","","","10.1007/978-3-030-49432-2_7","Davide TaibiKari Systä","2020","http://link.springer.com/chapter/10.1007/978-3-030-49432-2_7","Chapter"
"Decentralizing Data","Pro Microservices in .NET 6","","","","10.1007/978-1-4842-7833-8_6","Sean WhitesellRob RichardsonMatthew D. Groves","2022","http://link.springer.com/chapter/10.1007/978-1-4842-7833-8_6","Chapter"
"Monolith Migration Complexity Tuning Through the Application of Microservices Patterns","Software Architecture","","","","10.1007/978-3-030-58923-3_3","João Franscisco AlmeidaAntónio Rito Silva","2020","http://link.springer.com/chapter/10.1007/978-3-030-58923-3_3","Chapter"
